{
  "division": "Googlebot",
  "sortIndex": 1148,
  "lite": false,
  "standard": true,
  "userAgents": [
    {
      "userAgent": "Googlebot",
      "browser": "google bot",
      "properties": {
        "Parent": "DefaultProperties",
        "Comment": "Googlebot"
      },
      "children": [
        {
          "match": "Googlebot/Test*"
        },
        {
          "match": "GoogleBot/*"
        },
        {
          "match": "googlebot-urlconsole",
          "browser": "googlebot-urlconsole",
          "properties": {
            "Browser": "googlebot-urlconsole"
          }
        },
        {
          "match": "Googlebot-Image*",
          "browser": "google image search",
          "properties": {
            "Browser": "Google Image Search"
          }
        },
        {
          "match": "Googlebot-News*",
          "browser": "googlebot-news",
          "properties": {
            "Browser": "Googlebot-News"
          }
        },
        {
          "match": "Googlebot-Video/1.0*",
          "browser": "googlebot-video",
          "properties": {
            "Version": "1.0"
          }
        },
        {
          "match": "Googlebot-Video*",
          "browser": "googlebot-video",
          "properties": {
            "Browser": "Googlebot-Video"
          }
        },
        {
          "match": "Mozilla/5.0 (en-us) applewebkit* (*khtml*like*gecko* Google PP Default) Chrome/* Safari/*"
        },
        {
          "match": "googlebot*"
        },
        {
          "match": "GOOG*"
        }
      ]
    }
  ]
}
