{
  "division": "Listia App Generic",
  "sortIndex": 1073,
  "lite": false,
  "standard": true,
  "userAgents": [
    {
      "userAgent": "Listia App Generic",
      "platform": "iOS",
      "engine": "WebKit",
      "device": "general Mobile Device (Apple)",
      "properties": {
        "Parent": "DefaultProperties",
        "Browser_Maker": "Listia Inc.",
        "Browser_Type": "Application",
        "Frames": "true",
        "IFrames": "true",
        "Tables": "true",
        "Cookies": "true",
        "JavaScript": "true",
        "Crawler": "false",
        "Comment": "Listia App Generic",
        "Browser": "Listia App",
        "CssVersion": "3"
      },
      "children": [
        {
          "match": "Mozilla/5.0 (#DEVICE##PLATFORM#) applewebkit* (*khtml*like*gecko*) Mobile/* Listia/*",
          "devices": {
            "iPhone": "iPhone"
          },
          "platforms": [
            "iOS_A_10_3",
            "iOS_A"
          ]
        },
        {
          "match": "Mozilla/5.0 (#PLATFORM#) applewebkit* (*khtml*like*gecko*) Mobile/* Listia/*",
          "device": "general Mobile Device (Apple)",
          "platforms": [
            "iOS_A_10_3",
            "iOS_A"
          ]
        }
      ]
    }
  ]
}
