{
  "division": "Opera #MAJORVER#.#MINORVER#",
  "versions": ["11.60"],
  "sortIndex": 2820,
  "lite": true,
  "userAgents": [
    {
      "userAgent": "Opera #MAJORVER#.#MINORVER#",
      "properties": {
        "Parent": "DefaultProperties",
        "Comment": "Opera #MAJORVER#.#MINORVER#",
        "Browser": "Opera",
        "Version": "#MAJORVER#.#MINORVER#",
        "MajorVer": "#MAJORVER#",
        "MinorVer": "#MINORVER#",
        "Win32": "true",
        "Frames": "true",
        "IFrames": "true",
        "Tables": "true",
        "Cookies": "true",
        "JavaScript": "true",
        "JavaApplets": "true",
        "CssVersion": "3",
        "RenderingEngine_Name": "Presto",
        "RenderingEngine_Version": "2.10",
        "RenderingEngine_Description": "For Opera 7 and above, Macromedia Dreamweaver MX and MX 2004 (Mac), and Adobe Creative Suite 2."
      },
      "children": [
        {
          "match": "Mozilla\/?.*(#PLATFORM#)*Opera?#MAJORVER#.#MINORVER#*",
          "platforms": [
            "FreeBSD", "Linux", "OSX", "SunOS", "Win2000_2",
            "WinME", "Win95_2", "Win98_2", "WinME_2", "NT4", "Win2000",
            "WinXPa_32", "WinXPb_32", "Vista_32", "Win7_32"
          ]
        },
        {
          "match": "Mozilla\/?.*(*Opera?#MAJORVER#.#MINORVER##PLATFORM#)*",
          "platforms": [
            "FreeBSD", "Linux", "OSX", "SunOS", "Win2000_2",
            "WinME", "Win95_2", "Win98_2", "WinME_2", "NT4", "Win2000",
            "WinXPa_32", "WinXPb_32", "Vista_32", "Win7_32"
          ]
        },
        {
          "match": "Opera\/#MAJORVER#.#MINORVER#*(#PLATFORM#)*",
          "platforms": [
            "FreeBSD", "Linux", "OSX", "SunOS", "Win2000_2",
            "WinME", "Win95_2", "Win98_2", "WinME_2", "NT4", "Win2000",
            "WinXPa_32", "WinXPb_32", "Vista_32", "Win7_32"
          ]
        },
        {
          "match": "Opera\/9.80*(#PLATFORM#)*Version\/#MAJORVER#.#MINORVER#*",
          "platforms": [
            "FreeBSD", "Linux", "OSX", "SunOS", "Win2000_2",
            "WinME", "Win95_2", "Win98_2", "WinME_2", "NT4", "Win2000",
            "WinXPa_32", "WinXPb_32", "Vista_32", "Win7_32"
          ]
        }
      ]
    }
  ]
}