{
  "division": "Openwave Mobile Browser #MAJORVER#.#MINORVER#",
  "versions": ["7.2"],
  "sortIndex": 8210,
  "lite": false,
  "standard": true,
  "userAgents": [
    {
      "userAgent": "Openwave Mobile Browser #MAJORVER#.#MINORVER#",
      "device": "general Mobile Phone",
      "platform": "JAVA",
      "properties": {
        "Parent": "DefaultProperties",
        "Comment": "Openwave Mobile Browser #MAJORVER#.#MINORVER#",
        "Browser": "Openwave Mobile Browser",
        "Browser_Type": "Browser",
        "Browser_Maker": "Myriad Group",
        "Version": "#MAJORVER#.#MINORVER#"
      },
      "children": [
        {
          "match": "#DEVICE#/*UP.Browser/#MAJORVER#.#MINORVER#*",
          "devices": {
            "MOT-VE538": "Motorola VE538",
            "SAGEM-VF526": "Sagem VF526",
            "SAGEM-VF540": "Sagem VF540"
          }
        },
        {
          "match": "Nokia* UP.Browser/#MAJORVER#.#MINORVER#*",
          "device": "general Mobile Phone (Nokia)"
        },
        {
          "match": "* UP.Browser/#MAJORVER#.#MINORVER#*"
        },
        {
          "match": "*UP.Browser/#MAJORVER#.#MINORVER#*"
        }
      ]
    }
  ]
}
