{
  "division": "Twitter App",
  "sortIndex": 1950,
  "lite": true,
  "userAgents": [
    {
      "userAgent": "Twitter App",
      "engine": "WebKit",
      "properties": {
        "Parent": "DefaultProperties",
        "Comment": "Twitter App",
        "Browser": "Twitter App",
        "Browser_Type": "Application",
        "Browser_Maker": "Twitter",
        "Frames": "true",
        "IFrames": "true",
        "Tables": "true",
        "Cookies": "true",
        "JavaScript": "true",
        "isMobileDevice": "true",
        "CssVersion": "3",
        "Device_Type": "Mobile Phone",
        "Device_Pointing_Method": "touchscreen"
      },
      "children": [
        {
          "match": "Mozilla/5.0 (iPhone#PLATFORM#) AppleWebKit\/* (KHTML, like Gecko) Mobile\/* Twitter for iPhone",
          "device": "iPhone",
          "platforms": [
            "iOS_A_7_1", "iOS_A_8_0", "iOS_A"
          ]
        },
        {
          "match": "Mozilla/5.0 (#PLATFORM#) AppleWebKit\/* (KHTML, like Gecko) Mobile\/* Twitter*",
          "device": "general Mobile Device (Apple)",
          "platforms": [
            "iOS_A_7_1", "iOS_A_8_0", "iOS_A"
          ]
        }
      ]
    }
  ]
}