{
  "division": "XML Sitemaps Generator",
  "sortIndex": 170,
  "lite": false,
  "standard": true,
  "userAgents": [
    {
      "userAgent": "XML Sitemaps Generator",
      "engine": "Gecko",
      "properties": {
        "Parent": "DefaultProperties",
        "Comment": "XML Sitemaps Generator",
        "Browser": "XML Sitemaps Generator",
        "Browser_Maker": "XML Sitemaps",
        "Browser_Type": "Bot/Crawler",
        "Crawler": "true"
      },
      "children": [
        {
          "match": "XML Sitemaps Generator*",
          "engine": "unknown"
        },
        {
          "match": "Mozilla/5.0 (compatible; XML Sitemaps Generator; *) Gecko XML-Sitemaps/1.0*",
          "properties": {
            "Version": "1.0"
          }
        },
        {
          "match": "Mozilla/5.0 (compatible; XML Sitemaps Generator; *) Gecko XML-Sitemaps/*"
        }
      ]
    }
  ]
}
