{
  "division": "Opera Neon Generic",
  "sortIndex": 1044,
  "lite": false,
  "standard": true,
  "userAgents": [
    {
      "userAgent": "Opera Neon Generic",
      "browser": "opera neon",
      "engine": "Blink",
      "device": "Windows Desktop",
      "properties": {
        "Parent": "DefaultProperties",
        "Comment": "Opera Neon Generic"
      },
      "children": [
        {
          "match": "Mozilla/5.0 (#PLATFORM#) applewebkit* (*khtml*like*gecko*)*Chrome/*Safari/*MMS/*",
          "device": "Windows Desktop",
          "platforms": [
            "Win10_x64_B", "Win10_64_B", "Win10_32_B",
            "Win10_x64", "Win10_64", "Win10_32"
          ]
        },
        {
          "match": "Mozilla/5.0 (#PLATFORM#) applewebkit* (*khtml*like*gecko*)*Chrome/*Safari/*MMS/*",
          "device": "Macintosh",
          "platforms": [
            "OSX_10_12",
            "OSX"
          ]
        }
      ]
    }
  ]
}
