{
  "division": "QtWebEngine Generic",
  "sortIndex": 1177,
  "lite": false,
  "standard": true,
  "userAgents": [
    {
      "userAgent": "QtWebEngine Generic",
      "browser": "qtwebengine",
      "platform": "Windows",
      "engine": "Blink",
      "device": "Windows Desktop",
      "properties": {
        "Parent": "DefaultProperties",
        "Comment": "QtWebEngine Generic"
      },
      "children": [
        {
          "match": "Mozilla/5.0 (#PLATFORM#) applewebkit* (*khtml*like*gecko*) QtWebEngine/*Chrome/*Safari/*",
          "device": "Windows Desktop",
          "platforms": [
            "Win8_1_64", "Win8_1_32",
            "Win8_64", "Win8_32",
            "Win7_64", "Win7_32",
            "Vista_64", "Vista_32"
          ]
        }
      ]
    }
  ]
}
