{
  "division": "WordPress iPhone App",
  "sortIndex": 312,
  "lite": true,
  "userAgents": [
    {
      "userAgent": "WordPress iPhone App",
      "engine": "WebKit",
      "device": "general Mobile Device (Apple)",
      "properties": {
        "Parent": "DefaultProperties",
        "Comment": "WordPress iPhone App",
        "Browser": "WordPress iPhone App",
        "Browser_Type": "Application",
        "Browser_Maker": "WordPress.org",
        "Frames": "true",
        "Tables": "true"
      },
      "children": [
        {
          "match": "wp-iphone\/4.4 (#PLATFORM#, iPad) Mobile*",
          "properties": {
            "Version": "4.4",
            "MajorVer": "4",
            "MinorVer": "4"
          },
          "device": "iPad",
          "platforms": [
            "iOS_K_8_0", "iOS_K"
          ]
        },
        {
          "match": "wp-iphone\/* (#PLATFORM#, iPad) Mobile*",
          "device": "iPad",
          "platforms": [
            "iOS_K_8_0", "iOS_K"
          ]
        },
        {
          "match": "wp-iphone\/4.4 (#PLATFORM#) Mobile*",
          "properties": {
            "Version": "4.4",
            "MajorVer": "4",
            "MinorVer": "4"
          },
          "platforms": [
            "iOS_K_8_0", "iOS_K"
          ]
        },
        {
          "match": "wp-iphone\/* (#PLATFORM#) Mobile*",
          "platforms": [
            "iOS_K_8_0", "iOS_K"
          ]
        }
      ]
    }
  ]
}