{
  "division": "Thunderbird #MAJORVER#.#MINORVER#",
  "versions": ["52.4", "52.3", "52.2", "52.1", 52],
  "sortIndex": 3084,
  "lite": false,
  "standard": true,
  "userAgents": [
    {
      "userAgent": "Thunderbird #MAJORVER#.#MINORVER#",
      "engine": "Gecko_Major_Dynamic",
      "device": "general Desktop",
      "properties": {
        "Parent": "DefaultProperties",
        "Comment": "Thunderbird #MAJORVER#.#MINORVER#",
        "Browser": "Thunderbird",
        "Browser_Maker": "Mozilla Foundation",
        "Browser_Type": "Email Client",
        "Version": "#MAJORVER#.#MINORVER#"
      },
      "children": [
        {
          "match": "Mozilla/5.0 (#PLATFORM#)*Gecko*Thunderbird/#MAJORVER#.#MINORVER#*",
          "device": "Linux Desktop",
          "platforms": [
            "Linux_64", "Linux"
          ]
        },
        {
          "match": "Mozilla/5.0 (#PLATFORM#)*Gecko*Thunderbird/#MAJORVER#.#MINORVER#*",
          "device": "Windows Desktop",
          "platforms": [
            "Win10_64_B", "Win10_32_B",
            "Win8_1_64", "Win8_1_32",
            "Win8_64", "Win8_32",
            "Win7_64", "Win7_32",
            "Vista_64", "Vista_32",
            "WinXPa_64", "WinXPa_32", "WinXPb_64", "WinXPb_32"
          ]
        },
        {
          "match": "Mozilla/5.0 (#PLATFORM#)*Gecko*Thunderbird/#MAJORVER#.#MINORVER#*",
          "device": "Macintosh",
          "platforms": [
            "OSX_10_13", "OSX_10_12", "OSX_10_11", "OSX_10_10", "OSX_10_9",
            "OSX"
          ]
        },
        {
          "match": "Mozilla/5.0 (#PLATFORM#)*Gecko*Thunderbird/#MAJORVER#.#MINORVER#*",
          "platforms": [
            "SunOS"
          ]
        }
      ]
    }
  ]
}
