{
  "division": "akregator Generic",
  "sortIndex": 382,
  "lite": false,
  "standard": true,
  "userAgents": [
    {
      "userAgent": "akregator Generic",
      "browser": "akregator",
      "engine": "KHTML_Dynamic",
      "platform": "Linux",
      "device": "Linux Desktop",
      "properties": {
        "Parent": "DefaultProperties",
        "Comment": "akregator Generic"
      },
      "children": [
        {
          "match": "Mozilla/5.0 (X11;) applewebkit* (*khtml*like*gecko*) akregator/* Safari/*"
        },
        {
          "match": "Akregator/*"
        }
      ]
    }
  ]
}
