{
  "division": "Puffin #MAJORVER#.#MINORVER#",
  "versions": [3],
  "sortIndex": 1121,
  "lite": false,
  "standard": true,
  "userAgents": [
    {
      "userAgent": "Puffin #MAJORVER#.#MINORVER#",
      "engine": "Blink",
      "device": "general Mobile Phone (Touch)",
      "properties": {
        "Parent": "DefaultProperties",
        "Comment": "Puffin #MAJORVER#.#MINORVER#",
        "Browser": "Puffin",
        "Version": "#MAJORVER#.#MINORVER#",
        "MajorVer": "#MAJORVER#",
        "MinorVer": "#MINORVER#",
        "Browser_Type": "Browser",
        "Browser_Maker": "CloudMosa Inc.",
        "Frames": "true",
        "IFrames": "true",
        "Tables": "true",
        "Cookies": "true",
        "JavaScript": "true",
        "CssVersion": "2"
      },
      "children": [
        {
          "match": "Mozilla/5.0 (#PLATFORM#LG-E730 Build/*) applewebkit* (*khtml*like*gecko*) *Chrome/* Safari/* Puffin/#MAJORVER#*AP*",
          "device": "LG E730",
          "platforms": [
            "Android_4_0"
          ]
        },
        {
          "match": "Mozilla/5.0 (#PLATFORM#THOT61 Build/*) applewebkit* (*khtml*like*gecko*) *Chrome/* Safari/* Puffin/#MAJORVER#*AP*",
          "device": "Thornton Pickard THOT61",
          "platforms": [
            "Android_4_4"
          ]
        },
        {
          "match": "Mozilla/5.0 (#PLATFORM#) applewebkit* (*khtml*like*gecko*) *Chrome/* Safari/* Puffin/#MAJORVER#*AP*",
          "platforms": [
            "Android_4_0", "Android_4_1", "Android_4_2", "Android_4_3", "Android_4_4", "Android"
          ]
        },
        {
          "match": "Mozilla/5.0 (#PLATFORM#) applewebkit* (*khtml*like*gecko*) *Chrome/* Safari/* Puffin/#MAJORVER#*AT*",
          "device": "general Tablet",
          "platforms": [
            "Android_4_0", "Android_4_1", "Android_4_2", "Android_4_3", "Android_4_4", "Android"
          ]
        },
        {
          "match": "Mozilla/5.0 (*Linux x86_64*) applewebkit* (*khtml*like*gecko*) *Chrome/* Safari/* Puffin/#MAJORVER#*AP*",
          "platforms": [
            "Android"
          ]
        },
        {
          "match": "Mozilla/5.0 (*Linux x86_64*) applewebkit* (*khtml*like*gecko*) *Chrome/* Safari/* Puffin/#MAJORVER#*AT*",
          "device": "general Tablet",
          "platforms": [
            "Android"
          ]
        },
        {
          "match": "Mozilla/5.0 (*Linux x86_64*) applewebkit* (*khtml*like*gecko*) *Chrome/* Safari/* Puffin/#MAJORVER#*IP*",
          "device": "iPhone",
          "engine": "WebKit",
          "platforms": [
            "iOS"
          ]
        },
        {
          "match": "Mozilla/5.0 (*Linux x86_64*) applewebkit* (*khtml*like*gecko*) *Chrome/* Safari/* Puffin/#MAJORVER#*IT*",
          "device": "iPad",
          "engine": "WebKit",
          "platforms": [
            "iOS"
          ]
        },
        {
          "match": "Mozilla/5.0 (*Linux x86_64*) applewebkit* (*khtml*like*gecko*) *Chrome/* Safari/* Puffin/#MAJORVER#*I?*",
          "device": "general Mobile Device (Apple)",
          "engine": "WebKit",
          "platforms": [
            "iOS"
          ]
        },
        {
          "match": "Mozilla/5.0 (#DEVICE##PLATFORM#) applewebkit* (*khtml*like*gecko*) *Chrome/* Safari/* Puffin/#MAJORVER#*I?*",
          "devices": {
            "iPhone": "iPhone",
            "iPod": "iPod Touch"
          },
          "engine": "WebKit",
          "platforms": [
            "iOS_A_7_1", "iOS_A_7_0",
            "iOS_A_6_1", "iOS_A_6_0",
            "iOS_A_5_1", "iOS_A_5_0",
            "iOS_A"
          ]
        },
        {
          "match": "Mozilla/5.0 (#DEVICE##PLATFORM#) applewebkit* (*khtml*like*gecko*) *Chrome/* Safari/* Puffin/#MAJORVER#*I?*",
          "devices": {
            "iPad": "iPad"
          },
          "engine": "WebKit",
          "platforms": [
            "iOS_C_7_1", "iOS_C_7_0",
            "iOS_C_6_1", "iOS_C_6_0",
            "iOS_C_5_1", "iOS_C_5_0",
            "iOS_C"
          ]
        },
        {
          "match": "Mozilla/5.0 (#PLATFORM#) applewebkit* (*khtml*like*gecko*) *Chrome/* Safari/* Puffin/#MAJORVER#*I?*",
          "device": "general Mobile Device (Apple)",
          "engine": "WebKit",
          "platforms": [
            "iOS_A",
            "iOS_C"
          ]
        }
      ]
    }
  ]
}
