{
  "division": "Chrome #MAJORVER#.#MINORVER#",
  "versions": [36, 35, 34, 33, 32, 31, 30, 29, 28],
  "sortIndex": 1147,
  "lite": false,
  "standard": false,
  "userAgents": [
    {
      "userAgent": "Chrome #MAJORVER#.#MINORVER#",
      "engine": "Blink",
      "device": "general Desktop",
      "properties": {
        "Parent": "DefaultProperties",
        "Comment": "Chrome #MAJORVER#.#MINORVER#",
        "Browser": "Chrome",
        "Browser_Maker": "Google Inc",
        "Browser_Type": "Browser",
        "Version": "#MAJORVER#.#MINORVER#"
      },
      "children": [
        {
          "match": "Mozilla/5.0 (#PLATFORM#) applewebkit* (*khtml*like*gecko*) Chrome/#MAJORVER#.#MINORVER#*Safari/*",
          "device": "Linux Desktop",
          "platforms": [
            "ChromeOS_x64", "ChromeOS",
            "Linux_64", "Linux"
          ]
        },
        {
          "match": "Mozilla/5.0 (#PLATFORM#) applewebkit* (*khtml*like*gecko*) Debian Chrome/#MAJORVER#.#MINORVER#*Safari/*",
          "device": "Linux Desktop",
          "platforms": [
            "Debian"
          ]
        },
        {
          "match": "Mozilla/5.0 (#PLATFORM#) applewebkit* (*khtml*like*gecko*) Chrome/#MAJORVER#.#MINORVER#*Safari/*",
          "device": "Windows Desktop",
          "platforms": [
            "WinXPa_64", "WinXPa_32", "WinXPb_64", "WinXPb_32",
            "Vista_64", "Vista_32",
            "Win7_64", "Win7_32",
            "Win8_64", "Win8_32",
            "Win8_1_64", "Win8_1_32",
            "Win10_64", "Win10_32", "Win10_64_B", "Win10_32_B"
          ]
        },
        {
          "match": "Mozilla/5.0 (#PLATFORM#) applewebkit* (*khtml*like*gecko*) Chrome/#MAJORVER#.#MINORVER#*Safari/*",
          "device": "Macintosh",
          "platforms": [
            "OSX_10_12", "OSX_10_11", "OSX_10_10", "OSX_10_9", "OSX_10_8", "OSX_10_7", "OSX_10_6"
          ]
        },
        {
          "match": "Mozilla/5.0 (#PLATFORM#) applewebkit* (*khtml*like*gecko*) Chrome/#MAJORVER#.#MINORVER#*Safari/*",
          "device": "general Desktop",
          "platforms": [
            "FreeBSD_64", "FreeBSD_64_2", "FreeBSD",
            "OpenBSD_64_3", "OpenBSD_64_2", "OpenBSD_64", "OpenBSD",
            "NetBSD"
          ]
        },
        {
          "match": "Mozilla/5.0 (#PLATFORM#) applewebkit* (*khtml*like*gecko*) Chrome/#MAJORVER#.#MINORVER#* anonymized by*",
          "properties": {
            "isAnonymized": "true"
          },
          "device": "Windows Desktop",
          "platforms": [
            "WinXPa_64", "WinXPa_32", "WinXPb_64", "WinXPb_32",
            "Vista_64", "Vista_32",
            "Win7_64", "Win7_32",
            "Win8_64", "Win8_32",
            "Win8_1_64", "Win8_1_32",
            "Win10_64", "Win10_32", "Win10_64_B", "Win10_32_B"
          ]
        },
        {
          "match": "Mozilla/5.0 (#PLATFORM#) applewebkit* (*khtml*like*gecko*) Chrome/#MAJORVER#.#MINORVER#*Anonymisiert durch*",
          "properties": {
            "isAnonymized": "true"
          },
          "device": "Windows Desktop",
          "platforms": [
            "WinXPa_64", "WinXPa_32", "WinXPb_64", "WinXPb_32",
            "Vista_64", "Vista_32",
            "Win7_64", "Win7_32",
            "Win8_64", "Win8_32",
            "Win8_1_64", "Win8_1_32",
            "Win10_64", "Win10_32", "Win10_64_B", "Win10_32_B"
          ]
        },
        {
          "match": "Mozilla/5.0 (Web0S; Linux/SmartTV) applewebkit* (*khtml*like*gecko*) QtWebEngine/* Chrome/#MAJORVER#.#MINORVER#* Safari/*LGE; 49UH668V*",
          "device": "LG 49UH668V",
          "platforms": [
            "webOS_30"
          ]
        },
        {
          "match": "Mozilla/5.0 (Web0S; Linux/SmartTV) applewebkit* (*khtml*like*gecko*) QtWebEngine/* Chrome/#MAJORVER#.#MINORVER#* Safari/*",
          "device": "general TV Device",
          "platforms": [
            "webOS_30"
          ]
        },
        {
          "match": "Mozilla/5.0 (#PLATFORM#) applewebkit*(*khtml*like*gecko*) Chrome/#MAJORVER#.#MINORVER#* CrKey/*",
          "device": "Google Chromecast",
          "platforms": [
            "Chromecast_OS_ARM", "Chromecast_OS_64_ARM"
          ]
        },
        {
          "match": "Mozilla/5.0 (*CrKey arm*) applewebkit*(*khtml*like*gecko*) Chrome/#MAJORVER#.#MINORVER#*",
          "device": "Google Chromecast",
          "platforms": [
            "Chromecast_OS_ARM"
          ]
        }
      ]
    }
  ]
}
