{
  "division": "Baidu Browser HD #MAJORVER#.#MINORVER# for iOS",
  "versions": ["5.3", "5.2", "5.1", 5, 4, "3.5", "3.4", "3.3", "3.2", "3.1", 3, "2.6"],
  "sortIndex": 884,
  "lite": false,
  "standard": true,
  "userAgents": [
    {
      "userAgent": "Baidu Browser HD #MAJORVER#.#MINORVER# for iOS",
      "platform": "iOS",
      "engine": "WebKit",
      "device": "general Mobile Device (Apple)",
      "properties": {
        "Parent": "DefaultProperties",
        "Comment": "Baidu Browser HD #MAJORVER#.#MINORVER#",
        "Browser": "Baidu Browser HD",
        "Browser_Type": "Browser",
        "Browser_Maker": "Baidu",
        "Version": "#MAJORVER#.#MINORVER#",
        "MajorVer": "#MAJORVER#",
        "MinorVer": "#MINORVER#",
        "Frames": "true",
        "IFrames": "true",
        "Tables": "true",
        "Cookies": "true",
        "JavaScript": "true",
        "CssVersion": "3"
      },
      "children": [
        {
          "match": "Mozilla/5.0 (#DEVICE##PLATFORM#) applewebkit* (*khtml*like*gecko*) BaiduHD/#MAJORVER#.#MINORVER#* Mobile/* Safari/*",
          "devices": {
            "iPad": "iPad"
          },
          "platforms": [
            "iOS_A_10_3", "iOS_A_10_2", "iOS_A_10_1", "iOS_A_10_0",
            "iOS_A_9_3", "iOS_A_9_2", "iOS_A_9_1", "iOS_A_9_0",
            "iOS_A_8_4", "iOS_A_8_3", "iOS_A_8_2", "iOS_A_8_1", "iOS_A_8_0",
            "iOS_A_7_1", "iOS_A_7_0",
            "iOS_A_6_1", "iOS_A_6_0",
            "iOS_A",
            "iOS_C_10_3", "iOS_C_10_2", "iOS_C_10_1", "iOS_C_10_0",
            "iOS_C_9_3", "iOS_C_9_2", "iOS_C_9_1", "iOS_C_9_0",
            "iOS_C_8_4", "iOS_C_8_3", "iOS_C_8_2", "iOS_C_8_1", "iOS_C_8_0",
            "iOS_C_7_1", "iOS_C_7_0",
            "iOS_C_6_1", "iOS_C_6_0",
            "iOS_C"
          ]
        }
      ]
    }
  ]
}
