{
  "division": "PagePeeker Screenshot Maker",
  "sortIndex": 2959,
  "lite": false,
  "standard": true,
  "userAgents": [
    {
      "userAgent": "PagePeeker Screenshot Maker",
      "engine": "WebKit",
      "device": "Linux Desktop",
      "platform": "Linux",
      "properties": {
        "Parent": "DefaultProperties",
        "Comment": "PagePeeker Screenshot Maker",
        "Browser": "PagePeeker Screenshot Maker",
        "Browser_Type": "Bot/Crawler",
        "Browser_Maker": "pagepeeker SRL",
        "Crawler": "true"
      },
      "children": [
        {
          "match": "Mozilla/5.0 (#PLATFORM#) applewebkit* (*khtml*like*gecko*) domain.com Safari/*",
          "platforms": [
            "Linux_64", "Linux"
          ]
        }
      ]
    }
  ]
}
