{
  "division": "Division1",
  "versions": ["1.0"],
  "sortIndex": 200,
  "lite": true,
  "standard": true,
  "userAgents": [
    {
      "userAgent": "UA1",
      "properties": {
        "Parent": "DefaultProperties",
        "Comment": "UA1",
        "Browser": "UA1",
        "Version": "1.0",
        "MajorVer": "1",
        "MinorVer": "0"
      },
      "children": [
        {
          "match": "cde",
          "properties": "efg"
        }
      ]
    }
  ]
}
